{
  "version": 2,
  "at": "2026-08-10T12:00:14+00:00",
  "run_id": "20260810120000000000-adapter-pass",
  "project": "/workspace/acme",
  "role": "implement",
  "source_pool": "claude",
  "pool": "codex",
  "capacity_status": "headroom-unverified",
  "route_fingerprint": "c0b9a1fcb09c9f6447e670bf4f93a7484d75e8044b7426382a9fa26ee63f3fa3",
  "dispatch_fingerprint": "9a78354b489e0f9a00d885266a5d6e2450b106fa2ec274e4f0d1706c3c6c2e40",
  "dispatch_config_fingerprint": "5bc7fd4360f0727972522d405959937bff4e9caa2dd0a2bd749ef2e93dc133ee",
  "dispatch_exit_code": 0,
  "result_validation": "valid",
  "executor_status": "completed",
  "wall_clock_s": 10.0,
  "gate_status": "pass",
  "gate_passed": true,
  "outcome_status": "success",
  "triggers_fired": [],
  "notes": ""
}
